{"batch":{"id":"batch-0001","lot":"LOT-2026-0001-EXAMPLE-VERY-LONG-IDENTIFIER-0123456789"},"canonicalization":"RFC8785","distributor":{"id":"dist-0001","name":"Example Distribution Co. (fictional)"},"document":{"byte_length":982,"presentation_page_count":1,"sha256":"c6c48add6639a02e8326077624f78a5a854fcc493b44f7cbf069e474f393a9ff","template_version":"1.0","total_page_count":2},"environment":"demo","issuance_id":"iss_01J8Z3VECTOR0000000000001","issued_at":"2026-09-24T12:00:00Z","issuer":{"id":"demo-program","name":"Demo Program Operator (fictional)","role":"program_operator"},"key_id":"demo-program-k1","product":{"id":"prod-0001","name":"Example Ingredient"},"program_id":"demo-program","purchase_event":{"id":"sale-0001","purchase_date":"2026-09-23","received_at":"2026-09-24T11:00:00Z","statement":"Distributor system reports units of this batch purchased by this store"},"purpose":"store_coa_issuance","report":{"byte_length":655,"id":"report-0001","lab_name_as_reported":"Example Analytical Laboratory (fictional)","page_count":1,"provenance_basis":"submitted_report_reviewed","reference":"EAL-2026-000123","report_date":"2026-09-20","sha256":"89bc7e1f6b9909d02059d5bd86eb0cf7c8ff7a94093925886359062e28b2ee8d","version_id":"report-0001-v1"},"schema_version":"2.0","signature_algorithm":"Ed25519","signer":{"id":"coa-international","name":"COA International","role":"independent_verifier"},"store":{"id":"store-0001","name":"Example Corner Store (fictional)"},"verification_code":"7K3M9Q2XWD8FTN4RVB6HJC5P0YZA","verification_url":"https://coa.international/v/7K3M9Q2XWD8FTN4RVB6HJC5P0YZA"}